{
  "audit_id": "audit-39c66b89-0249-4e23-94fd-e8dc6adb4ade",
  "intent_text": "set all line's throughput/hr to 150",
  "operations": [
    {
      "op": "replace",
      "path": "/lines/line_1/tooling_policy/required_scope",
      "value": "NONE"
    },
    {
      "op": "replace",
      "path": "/lines/line_1/selected_tool_ids",
      "value": []
    },
    {
      "op": "replace",
      "path": "/lines/line_1/excluded_tool_ids",
      "value": []
    },
    {
      "op": "replace",
      "path": "/lines/line_1/allowed_instruments",
      "value": []
    },
    {
      "op": "replace",
      "path": "/lines/line_1/excluded_instruments",
      "value": []
    },
    {
      "op": "replace",
      "path": "/lines/line_1/kpi/min_throughput_per_hour",
      "value": 150
    },
    {
      "op": "replace",
      "path": "/lines/line_2/tooling_policy/required_scope",
      "value": "NONE"
    },
    {
      "op": "replace",
      "path": "/lines/line_2/selected_tool_ids",
      "value": []
    },
    {
      "op": "replace",
      "path": "/lines/line_2/excluded_tool_ids",
      "value": []
    },
    {
      "op": "replace",
      "path": "/lines/line_2/allowed_instruments",
      "value": []
    },
    {
      "op": "replace",
      "path": "/lines/line_2/excluded_instruments",
      "value": []
    },
    {
      "op": "replace",
      "path": "/lines/line_2/kpi/min_throughput_per_hour",
      "value": 150
    },
    {
      "op": "replace",
      "path": "/lines/line_3/tooling_policy/required_scope",
      "value": "NONE"
    },
    {
      "op": "replace",
      "path": "/lines/line_3/selected_tool_ids",
      "value": []
    },
    {
      "op": "replace",
      "path": "/lines/line_3/excluded_tool_ids",
      "value": []
    },
    {
      "op": "replace",
      "path": "/lines/line_3/allowed_instruments",
      "value": []
    },
    {
      "op": "replace",
      "path": "/lines/line_3/excluded_instruments",
      "value": []
    },
    {
      "op": "replace",
      "path": "/lines/line_3/kpi/min_throughput_per_hour",
      "value": 150
    },
    {
      "op": "replace",
      "path": "/lines/line_4/tooling_policy/required_scope",
      "value": "NONE"
    },
    {
      "op": "replace",
      "path": "/lines/line_4/selected_tool_ids",
      "value": []
    },
    {
      "op": "replace",
      "path": "/lines/line_4/excluded_tool_ids",
      "value": []
    },
    {
      "op": "replace",
      "path": "/lines/line_4/allowed_instruments",
      "value": []
    },
    {
      "op": "replace",
      "path": "/lines/line_4/excluded_instruments",
      "value": []
    },
    {
      "op": "replace",
      "path": "/lines/line_4/kpi/min_throughput_per_hour",
      "value": 150
    }
  ],
  "operator_id": "op_001",
  "patch_id": "patch-1781619195762",
  "reason": "test for milestone 9",
  "rejection_reasons": [],
  "run_artifact_id": null,
  "scenario_spec_id": null,
  "status": "ACCEPTED",
  "timestamp_utc": "2026-06-16T14:13:24.551064Z",
  "trt_after_hash": "a4d3afccf023381f1f91c0a6db9caa1af2d27792f6a4aed1ecadfc0982661ab9",
  "trt_after_version": "v6",
  "trt_before_hash": "61b04831029ab0093f7cf6289e0c2e04be8bfe2dfe508f3ab462e11e291ef4ae",
  "trt_before_version": "v5",
  "trt_id": "trt-demo",
  "validation_results": {
    "base_version": true,
    "path_whitelist": true,
    "readonly": true,
    "schema": true,
    "semantic": true
  }
}