{
  "audit_id": "audit-b4660646-ac5c-4eba-893d-148fc1032bab",
  "intent_text": "Set all production lines to target the ENT surgical tooling set and make their robots pick ENT-required tooling first. Set add_reference_number to 5.",
  "operations": [
    {
      "op": "replace",
      "path": "/lines/line_1/manipulator_priority",
      "value": {
        "enabled": true,
        "ordered_normalized_types": [],
        "ordered_tool_ids": [],
        "policy": "REQUIRED_FIRST",
        "tie_breaker": "FCFS"
      }
    },
    {
      "op": "replace",
      "path": "/lines/line_1/target_set_id",
      "value": "ENT_SURGICAL_TOOLING_SET"
    },
    {
      "op": "replace",
      "path": "/lines/line_2/manipulator_priority",
      "value": {
        "enabled": true,
        "ordered_normalized_types": [],
        "ordered_tool_ids": [],
        "policy": "REQUIRED_FIRST",
        "tie_breaker": "FCFS"
      }
    },
    {
      "op": "replace",
      "path": "/lines/line_2/target_set_id",
      "value": "ENT_SURGICAL_TOOLING_SET"
    },
    {
      "op": "replace",
      "path": "/lines/line_3/manipulator_priority",
      "value": {
        "enabled": true,
        "ordered_normalized_types": [],
        "ordered_tool_ids": [],
        "policy": "REQUIRED_FIRST",
        "tie_breaker": "FCFS"
      }
    },
    {
      "op": "replace",
      "path": "/lines/line_3/target_set_id",
      "value": "ENT_SURGICAL_TOOLING_SET"
    },
    {
      "op": "replace",
      "path": "/lines/line_4/manipulator_priority",
      "value": {
        "enabled": true,
        "ordered_normalized_types": [],
        "ordered_tool_ids": [],
        "policy": "REQUIRED_FIRST",
        "tie_breaker": "FCFS"
      }
    },
    {
      "op": "replace",
      "path": "/lines/line_4/target_set_id",
      "value": "ENT_SURGICAL_TOOLING_SET"
    }
  ],
  "operator_id": "op_001",
  "patch_id": "patch_b578fd31-0df3-4ebd-b79f-baa4d5af8d5c",
  "reason": "test for milestone 11",
  "rejection_reasons": [],
  "run_artifact_id": null,
  "scenario_spec_id": null,
  "status": "ACCEPTED",
  "timestamp_utc": "2026-06-22T11:01:38.424821Z",
  "trt_after_hash": "fa7923a9c4b29a27157773bab4174b742d8de8d71a5c7e7892f1e15a8089b942",
  "trt_after_version": "v50",
  "trt_before_hash": "465c7be2ac59adc68fb17f3c8b10e3cb4af0c72b56610d364e6bcd04f6ef37c3",
  "trt_before_version": "v49",
  "trt_id": "trt-demo",
  "validation_results": {
    "base_version": true,
    "path_whitelist": true,
    "readonly": true,
    "schema": true,
    "semantic": true
  }
}