{
  "audit_id": "audit-ecb3ead1-e9cd-4320-b155-578f58830873",
  "intent_text": "set line 1 to prioritize non-scissors tooling, set line 2 target to knife handle, and set all lines throughput/hr to at least 100 and set simulated tooling count per production line to 2 (M12 full test target total simulated tooling: 8)",
  "operations": [
    {
      "op": "replace",
      "path": "/lines/line_1/manipulator_priority",
      "value": {
        "enabled": true,
        "ordered_normalized_types": [],
        "ordered_tool_ids": [],
        "policy": "FCFS",
        "tie_breaker": "FCFS"
      }
    },
    {
      "op": "replace",
      "path": "/lines/line_2/tooling_policy/required_scope",
      "value": "SELECTED_TOOLING"
    },
    {
      "op": "replace",
      "path": "/lines/line_2/selected_tool_ids",
      "value": [
        "tool_16",
        "tool_17",
        "tool_18"
      ]
    },
    {
      "op": "replace",
      "path": "/lines/line_2/selected_normalized_types",
      "value": [
        "KNIFE_HANDLE"
      ]
    },
    {
      "op": "replace",
      "path": "/lines/line_1/kpi/min_throughput_per_hour",
      "value": 100
    },
    {
      "op": "replace",
      "path": "/lines/line_2/kpi/min_throughput_per_hour",
      "value": 100
    },
    {
      "op": "replace",
      "path": "/lines/line_3/kpi/min_throughput_per_hour",
      "value": 100
    },
    {
      "op": "replace",
      "path": "/lines/line_4/kpi/min_throughput_per_hour",
      "value": 100
    }
  ],
  "operator_id": "op_001",
  "patch_id": "patch-1783109229702",
  "reason": "M12 manual comparison test TC3-fixture_our_setup_iv_03",
  "rejection_reasons": [],
  "run_artifact_id": null,
  "scenario_spec_id": null,
  "status": "ACCEPTED",
  "timestamp_utc": "2026-07-03T20:07:14.273088Z",
  "trt_after_hash": "fe28f0b43d1ad405a6f2a43f5756a72ba58f7715b696f188d3e956195503c27e",
  "trt_after_version": "v138",
  "trt_before_hash": "8c6aed3dc4107924fa7a006cbd4e2f25672bd692d3aabfe799c4c6b1f324ee67",
  "trt_before_version": "v137",
  "trt_id": "trt-demo",
  "validation_results": {
    "base_version": true,
    "path_whitelist": true,
    "readonly": true,
    "schema": true,
    "semantic": true
  }
}