{
  "audit_id": "audit-f4e7ed2a-6c04-4cb7-8fc7-4544ea4525c6",
  "intent_text": "set the line 1's throughput/hr to 150",
  "operations": [
    {
      "op": "replace",
      "path": "/lines/line_1/tooling_policy/required_scope",
      "value": "NONE"
    },
    {
      "op": "replace",
      "path": "/lines/line_1/selected_tool_ids",
      "value": []
    },
    {
      "op": "replace",
      "path": "/lines/line_1/excluded_tool_ids",
      "value": []
    },
    {
      "op": "replace",
      "path": "/lines/line_1/allowed_instruments",
      "value": []
    },
    {
      "op": "replace",
      "path": "/lines/line_1/excluded_instruments",
      "value": []
    },
    {
      "op": "replace",
      "path": "/lines/line_1/kpi/min_throughput_per_hour",
      "value": 150
    }
  ],
  "operator_id": "op_001",
  "patch_id": "patch-1781290572103",
  "reason": "deadline!!",
  "rejection_reasons": [],
  "run_artifact_id": null,
  "scenario_spec_id": null,
  "status": "ACCEPTED",
  "timestamp_utc": "2026-06-12T18:56:37.837120Z",
  "trt_after_hash": "5d6ba77ed329dc5acdc2cb4e9e2bfcfd4c07907772f6fb642c0b8851c47deed4",
  "trt_after_version": "v2",
  "trt_before_hash": "139e64052f9bc6e0d7df4122c579b7c2dca92e7eec82b62ffc7ed9e6b14ae252",
  "trt_before_version": "v1",
  "trt_id": "trt-demo",
  "validation_results": {
    "base_version": true,
    "path_whitelist": true,
    "readonly": true,
    "schema": true,
    "semantic": true
  }
}