{
  "audit_id": "audit-2b24f6b1-b45f-47ad-847b-45e11e3038f4",
  "intent_text": "set all line's throughput/hr back to 120",
  "operations": [
    {
      "op": "replace",
      "path": "/lines/line_1/tooling_policy/required_scope",
      "value": "NONE"
    },
    {
      "op": "replace",
      "path": "/lines/line_1/selected_tool_ids",
      "value": []
    },
    {
      "op": "replace",
      "path": "/lines/line_1/excluded_tool_ids",
      "value": []
    },
    {
      "op": "replace",
      "path": "/lines/line_1/allowed_instruments",
      "value": []
    },
    {
      "op": "replace",
      "path": "/lines/line_1/excluded_instruments",
      "value": []
    },
    {
      "op": "replace",
      "path": "/lines/line_1/kpi/min_throughput_per_hour",
      "value": 120
    },
    {
      "op": "replace",
      "path": "/lines/line_2/tooling_policy/required_scope",
      "value": "NONE"
    },
    {
      "op": "replace",
      "path": "/lines/line_2/selected_tool_ids",
      "value": []
    },
    {
      "op": "replace",
      "path": "/lines/line_2/excluded_tool_ids",
      "value": []
    },
    {
      "op": "replace",
      "path": "/lines/line_2/allowed_instruments",
      "value": []
    },
    {
      "op": "replace",
      "path": "/lines/line_2/excluded_instruments",
      "value": []
    },
    {
      "op": "replace",
      "path": "/lines/line_2/kpi/min_throughput_per_hour",
      "value": 120
    },
    {
      "op": "replace",
      "path": "/lines/line_3/tooling_policy/required_scope",
      "value": "NONE"
    },
    {
      "op": "replace",
      "path": "/lines/line_3/selected_tool_ids",
      "value": []
    },
    {
      "op": "replace",
      "path": "/lines/line_3/excluded_tool_ids",
      "value": []
    },
    {
      "op": "replace",
      "path": "/lines/line_3/allowed_instruments",
      "value": []
    },
    {
      "op": "replace",
      "path": "/lines/line_3/excluded_instruments",
      "value": []
    },
    {
      "op": "replace",
      "path": "/lines/line_3/kpi/min_throughput_per_hour",
      "value": 120
    },
    {
      "op": "replace",
      "path": "/lines/line_4/tooling_policy/required_scope",
      "value": "NONE"
    },
    {
      "op": "replace",
      "path": "/lines/line_4/selected_tool_ids",
      "value": []
    },
    {
      "op": "replace",
      "path": "/lines/line_4/excluded_tool_ids",
      "value": []
    },
    {
      "op": "replace",
      "path": "/lines/line_4/allowed_instruments",
      "value": []
    },
    {
      "op": "replace",
      "path": "/lines/line_4/excluded_instruments",
      "value": []
    },
    {
      "op": "replace",
      "path": "/lines/line_4/kpi/min_throughput_per_hour",
      "value": 120
    }
  ],
  "operator_id": "op_001",
  "patch_id": "patch-1781617752193",
  "reason": "test for milestone 9",
  "rejection_reasons": [],
  "run_artifact_id": null,
  "scenario_spec_id": null,
  "status": "ACCEPTED",
  "timestamp_utc": "2026-06-16T13:49:38.016243Z",
  "trt_after_hash": "61b04831029ab0093f7cf6289e0c2e04be8bfe2dfe508f3ab462e11e291ef4ae",
  "trt_after_version": "v5",
  "trt_before_hash": "4116b61b96998994b38a117d021e6a6b47c1d1c02be3ce9ee82df655b66743de",
  "trt_before_version": "v4",
  "trt_id": "trt-demo",
  "validation_results": {
    "base_version": true,
    "path_whitelist": true,
    "readonly": true,
    "schema": true,
    "semantic": true
  }
}