{
  "audit_id": "audit-3e75813a-6d42-41c4-8aa0-47f6bfc13ee4",
  "intent_text": "today there are two production lines. my arrival time is 4 seconds, the time required to resolve the tangling issue is 5 seconds, and the recovery time is 0.5 seconds. in the event of an anomaly, pls configure the logic so that continue until i arrive at the production line. the allow overlap ratio is 0.8. adjust the throughput/hr for all production lines to at least 85; set the tooling picking target for production lines 2 to knife handle; and adjust the tooling picking order for production lines 1 to prioritize picking tooling other than ent tooling set.",
  "operations": [
    {
      "op": "replace",
      "path": "/lines/line_1/abnormal_strategy",
      "value": "CONTINUE_FEASIBLE_TASKS"
    },
    {
      "op": "replace",
      "path": "/lines/line_2/abnormal_strategy",
      "value": "CONTINUE_FEASIBLE_TASKS"
    },
    {
      "op": "replace",
      "path": "/lines/line_3/abnormal_strategy",
      "value": "CONTINUE_FEASIBLE_TASKS"
    },
    {
      "op": "replace",
      "path": "/lines/line_4/abnormal_strategy",
      "value": "CONTINUE_FEASIBLE_TASKS"
    },
    {
      "op": "replace",
      "path": "/lines/line_1/kpi/min_throughput_per_hour",
      "value": 85
    },
    {
      "op": "replace",
      "path": "/lines/line_2/kpi/min_throughput_per_hour",
      "value": 85
    },
    {
      "op": "replace",
      "path": "/lines/line_3/kpi/min_throughput_per_hour",
      "value": 85
    },
    {
      "op": "replace",
      "path": "/lines/line_4/kpi/min_throughput_per_hour",
      "value": 85
    },
    {
      "op": "replace",
      "path": "/lines/line_2/manipulator_priority",
      "value": {
        "enabled": true,
        "ordered_normalized_types": [],
        "ordered_tool_ids": [],
        "policy": "FCFS",
        "tie_breaker": "FCFS"
      }
    },
    {
      "op": "replace",
      "path": "/lines/line_2/tooling_policy/required_scope",
      "value": "SELECTED_TOOLING"
    },
    {
      "op": "replace",
      "path": "/lines/line_1/manipulator_priority",
      "value": {
        "enabled": true,
        "ordered_normalized_types": [],
        "ordered_tool_ids": [],
        "policy": "REQUIRED_FIRST",
        "tie_breaker": "FCFS"
      }
    },
    {
      "op": "replace",
      "path": "/lines/line_1/target_set_id",
      "value": "ENT_SURGICAL_TOOLING_SET"
    }
  ],
  "operator_id": "op_001",
  "patch_id": "patch-1784391063084",
  "reason": "testing",
  "rejection_reasons": [],
  "run_artifact_id": null,
  "scenario_spec_id": null,
  "status": "ACCEPTED",
  "timestamp_utc": "2026-07-18T16:11:08.592390Z",
  "trt_after_hash": "de16128b380413967a22610193ba1cf138c13c53c0b0555ad5989d3ca4901119",
  "trt_after_version": "v164",
  "trt_before_hash": "0e9b55332d504f21ebe79fb6741423600af460b6874c9c3d3903424eda5f8e9a",
  "trt_before_version": "v163",
  "trt_id": "trt-demo",
  "validation_results": {
    "base_version": true,
    "path_whitelist": true,
    "readonly": true,
    "schema": true,
    "semantic": true
  }
}