{
  "audit_id": "audit-4437cfc5-f343-41ea-b46f-cd7cf1b212e7",
  "intent_text": "set line 1 throughput/hr to at least 90 and set simulated tooling count per production line to 4 and run this as a two-production-line simulation (M12 full test target total simulated tooling: 8)",
  "operations": [
    {
      "op": "replace",
      "path": "/lines/line_1/kpi/min_throughput_per_hour",
      "value": 90
    }
  ],
  "operator_id": "op_001",
  "patch_id": "patch-1783087737552",
  "reason": "m12 seed",
  "rejection_reasons": [],
  "run_artifact_id": null,
  "scenario_spec_id": null,
  "status": "ACCEPTED",
  "timestamp_utc": "2026-07-03T14:09:14.117602Z",
  "trt_after_hash": "9c8ba42c806da0887696683c78ac050481c0398405217868c33a1c04ea149edf",
  "trt_after_version": "v82",
  "trt_before_hash": "563525d17c8d34cb51a93f53e6bb3fde9a2f28fdfd5d5ffe2a2f90821bbf50f4",
  "trt_before_version": "v81",
  "trt_id": "trt-demo",
  "validation_results": {
    "base_version": true,
    "path_whitelist": true,
    "readonly": true,
    "schema": true,
    "semantic": true
  }
}