{
  "audit_id": "audit-f6a7ebf0-0218-4082-ab95-33fcafa5bf41",
  "intent_text": "set line 3 throughput/hr to at least 90 and set simulated tooling count per production line to 3 and run this as a four-production-line simulation (M12 full test target total simulated tooling: 12)",
  "operations": [
    {
      "op": "replace",
      "path": "/lines/line_3/kpi/min_throughput_per_hour",
      "value": 90
    }
  ],
  "operator_id": "op_001",
  "patch_id": "patch-1783092377707",
  "reason": "m12 seed",
  "rejection_reasons": [],
  "run_artifact_id": null,
  "scenario_spec_id": null,
  "status": "ACCEPTED",
  "timestamp_utc": "2026-07-03T15:26:21.620853Z",
  "trt_after_hash": "b21f0c287ff755b8d0fc4276ffccf2b2950e85ef0ca62d2c9399bdf723e710a4",
  "trt_after_version": "v95",
  "trt_before_hash": "c9cc0f06bad6a65c420449319a79bb08d66c0b56a852a84acee47240b7242727",
  "trt_before_version": "v94",
  "trt_id": "trt-demo",
  "validation_results": {
    "base_version": true,
    "path_whitelist": true,
    "readonly": true,
    "schema": true,
    "semantic": true
  }
}