{
  "audit_id": "audit-5fb7b817-7370-4eb7-8e4f-6f94e692a9cf",
  "intent_text": "with two production lines remaining stop the robotic arms immediately upon anomaly detection and set simulated tooling count per production line to 5 (M12 full test target total simulated tooling: 10)",
  "operations": [],
  "operator_id": "op_001",
  "patch_id": "patch-1783104983369",
  "reason": "M12 manual comparison test TC3-fixture_our_setup_iii_a_04",
  "rejection_reasons": [],
  "run_artifact_id": null,
  "scenario_spec_id": null,
  "status": "ACCEPTED",
  "timestamp_utc": "2026-07-03T18:56:29.106085Z",
  "trt_after_hash": "c0d4fec012cd9b6b655720a6627ea28a2dda2ca8d62754344c791f26217fe8bc",
  "trt_after_version": "v128",
  "trt_before_hash": "5ea62e2cfe0bd254c4aba0377edd6dc29c947d9658edd89817337aa0c534ec26",
  "trt_before_version": "v127",
  "trt_id": "trt-demo",
  "validation_results": {
    "base_version": true,
    "path_whitelist": true,
    "readonly": true,
    "schema": true,
    "semantic": true
  }
}