{
  "audit_id": "audit-670ca7c6-5b8d-4b9f-9608-4515ba0b90dc",
  "intent_text": "Line 1 should prioritize Trauma Set. Exclude forceps if possible. If entanglement occurs, continue feasible tasks when safe.",
  "operations": [
    {
      "op": "replace",
      "path": "/lines/line_1/tooling_policy/all_required",
      "value": false
    },
    {
      "op": "replace",
      "path": "/lines/line_1/goal",
      "value": "TRAUMA_SET_PRIORITY"
    },
    {
      "op": "replace",
      "path": "/lines/line_1/excluded_instruments",
      "value": [
        "FORCEPS"
      ]
    },
    {
      "op": "replace",
      "path": "/lines/line_1/kpi/deadline_minutes",
      "value": null
    },
    {
      "op": "replace",
      "path": "/lines/line_1/kpi/max_downtime_seconds",
      "value": null
    },
    {
      "op": "replace",
      "path": "/lines/line_1/abnormal_strategy",
      "value": "CONTINUE_FEASIBLE_TASKS"
    }
  ],
  "operator_id": "op_001",
  "patch_id": "patch-1780387059928",
  "reason": "urgent trauma set deadline",
  "rejection_reasons": [],
  "run_artifact_id": null,
  "scenario_spec_id": null,
  "status": "ACCEPTED",
  "timestamp_utc": "2026-06-02T07:57:46.238817Z",
  "trt_after_hash": "6747a6247e1b64940da859869183692c7fbea5416c8b4bfd5f65c600597e9843",
  "trt_after_version": "v18",
  "trt_before_hash": "8da26ec24f0103ce1ead6861225d46b397ae9e6105c93b021c419830d0447b49",
  "trt_before_version": "v17",
  "trt_id": "trt-demo",
  "validation_results": {
    "base_version": true,
    "path_whitelist": true,
    "readonly": true,
    "schema": true,
    "semantic": true
  }
}